NUM TRAIN = 1
(venv) pintura@Pintura FintuneLLM-master-4 % python newwy_train.py
Transformers version: 4.56.2
🟢 Loading whitelist TRAIN rows 1–350 ...
✅ Loaded 350 items from csv_train_new/white (rows 1-350)
   e.g. first 3: ['row_1_classroom.google.com__analyzed.csv', 'row_2_www.dek-d.com__analyzed.csv', 'row_3_www.catdumb.com__analyzed.csv']
 Wrote 350 file names → logs/train_white_files.txt
✅ No missing white TRAIN rows
🔴 Loading blacklist TRAIN rows 1–350 ...
✅ Loaded 350 items from csv_train_new/black (rows 1-350)
   e.g. first 3: ['row_1_zro-sushi_analyzed.csv', 'row_2_xoxo-100746.weeblysite.com__analyzed.csv', 'row_3_www.opinionstage.com_page_1b58cfeb-47a6-4952-91cd-f34bada7d95d_analyzed.csv']
 Wrote 350 file names → logs/train_black_files.txt
✅ No missing black TRAIN rows

🧪 Loading whitelist TEST rows 351–400 ...
✅ Loaded 50 items from csv_train_new/white (rows 351-400)
   e.g. first 3: ['row_351_th.edreams.com__analyzed.csv', 'row_352_www.coches.com__analyzed.csv', 'row_353_urbansportsclub.com_en_analyzed.csv']
 Wrote 50 file names → logs/test_white_files.txt
✅ No missing white TEST rows
🧪 Loading blacklist TEST rows 351–400 ...
✅ Loaded 50 items from csv_train_new/black (rows 351-400)
   e.g. first 3: ['row_351_gold1-1.github_analyzed.csv', 'row_352_paysuccessfully_analyzed.csv', 'row_353_analyzed.csv']
 Wrote 50 file names → logs/test_black_files.txt
✅ No missing black TEST rows
📄 Combined manifest → logs/manifest_all_splits.csv

📊 Training Data Distribution:
label
0    350
1    350
Name: count, dtype: int64

📊 Test Data Distribution:
label
0    50
1    50
Name: count, dtype: int64

✅ Datasets created:
   🚀 Training dataset: 700 examples
   🧪 Test dataset: 100 examples
Some weights of BertForSequenceClassification were not initialized from the model checkpoint at bert-base-uncased and are newly initialized: ['classifier.bias', 'classifier.weight']
You should probably TRAIN this model on a down-stream task to be able to use it for predictions and inference.

🔄 Tokenizing datasets...
Map: 100%|█████████████████████████████████████████████████████████████████████████████████████████████████████| 700/700 [00:01<00:00, 636.59 examples/s]
Map: 100%|█████████████████████████████████████████████████████████████████████████████████████████████████████| 100/100 [00:00<00:00, 638.07 examples/s]

🚀 Starting model training...
📊 Training on 700 examples, evaluating on 100 examples
  0%|                                                                                                                            | 0/175 [00:00<?, ?it/s]/Users/pintura/Downloads/FintuneLLM-master-4/venv/lib/python3.13/site-packages/torch/utils/data/dataloader.py:684: UserWarning: 'pin_memory' argument is set as true but not supported on MPS now, then device pinned memory won't be used.
  warnings.warn(warn_msg)
{'loss': 0.6546, 'grad_norm': 5.605724334716797, 'learning_rate': 9.800000000000001e-06, 'epoch': 0.29}                                                                                                      
{'loss': 0.562, 'grad_norm': 6.483325481414795, 'learning_rate': 1.98e-05, 'epoch': 0.57}                                                                                                                    
{'loss': 0.463, 'grad_norm': 32.56440734863281, 'learning_rate': 6.9333333333333344e-06, 'epoch': 0.86}                                                                                                      
{'eval_loss': 0.28515976667404175, 'eval_accuracy': 0.89, 'eval_runtime': 12.8432, 'eval_samples_per_second': 7.786, 'eval_steps_per_second': 1.947, 'epoch': 1.0}                                           
{'train_runtime': 1147.452, 'train_samples_per_second': 0.61, 'train_steps_per_second': 0.153, 'train_loss': 0.517713429587228, 'epoch': 1.0}                                                                
100%|██████████████████████████████████████████████████████████████████████████████████████████████████████████████████████████████████████████████████████████████████████| 175/175 [19:07<00:00,  6.56s/it]
✅ Training completed.

🧪 Running final evaluation...
/Users/pintura/Downloads/FintuneLLM-master-4/venv/lib/python3.13/site-packages/torch/utils/data/dataloader.py:684: UserWarning: 'pin_memory' argument is set as true but not supported on MPS now, then device pinned memory won't be used.
  warnings.warn(warn_msg)
100%|████████████████████████████████████████████████████████████████████████████████████████████████████████████████████████████████████████████████████████████████████████| 25/25 [00:06<00:00,  4.09it/s]
📊 Final Evaluation Results:
   eval_loss: 0.2852
   eval_accuracy: 0.8900
   eval_runtime: 7.0180
   eval_samples_per_second: 14.2490
   eval_steps_per_second: 3.5620
   epoch: 1.0000

 Generating detailed predictions...
/Users/pintura/Downloads/FintuneLLM-master-4/venv/lib/python3.13/site-packages/torch/utils/data/dataloader.py:684: UserWarning: 'pin_memory' argument is set as true but not supported on MPS now, then device pinned memory won't be used.
  warnings.warn(warn_msg)
100%|████████████████████████████████████████████████████████████████████████████████████████████████████████████████████████████████████████████████████████████████████████| 25/25 [00:05<00:00,  4.37it/s]

📊 Detailed Classification Report:
              precision    recall  f1-score   support

Not Phishing       0.88      0.90      0.89        50
    Phishing       0.90      0.88      0.89        50

    accuracy                           0.89       100
   macro avg       0.89      0.89      0.89       100
weighted avg       0.89      0.89      0.89       100


💾 Model saved to: phishing_train_1

============================================================
📦 FINAL TRAINING REPORT
============================================================
📊 Training Data:
   🟢 Not Phishing (white): 350 files used
   🔴 Phishing (black): 350 files used
   📊 Total training: 700 examples

🧪 Test Data:
   🟢 Not Phishing (white): 50 files used
   🔴 Phishing (black): 50 files used
   📊 Total test: 100 examples

 See detailed file lists in: logs (TXT manifests) and logs/manifest_all_splits.csv
============================================================

NUM TRAIN = 3
pintura@Pintura FintuneLLM-master-4 % ./venv/bin/python newwy_train.py
Transformers version: 4.56.2
🟢 Loading whitelist TRAIN rows 1–350 ...
✅ Loaded 350 items from csv_train_new/white (rows 1-350)
   e.g. first 3: ['row_1_classroom.google.com__analyzed.csv', 'row_2_www.dek-d.com__analyzed.csv', 'row_3_www.catdumb.com__analyzed.csv']
 Wrote 350 file names → logs/train_white_files.txt
✅ No missing white TRAIN rows
🔴 Loading blacklist TRAIN rows 1–350 ...
✅ Loaded 350 items from csv_train_new/black (rows 1-350)
   e.g. first 3: ['row_1_zro-sushi_analyzed.csv', 'row_2_xoxo-100746.weeblysite.com__analyzed.csv', 'row_3_www.opinionstage.com_page_1b58cfeb-47a6-4952-91cd-f34bada7d95d_analyzed.csv']
 Wrote 350 file names → logs/train_black_files.txt
✅ No missing black TRAIN rows

🧪 Loading whitelist TEST rows 351–400 ...
✅ Loaded 50 items from csv_train_new/white (rows 351-400)
   e.g. first 3: ['row_351_th.edreams.com__analyzed.csv', 'row_352_www.coches.com__analyzed.csv', 'row_353_urbansportsclub.com_en_analyzed.csv']
 Wrote 50 file names → logs/test_white_files.txt
✅ No missing white TEST rows
🧪 Loading blacklist TEST rows 351–400 ...
✅ Loaded 50 items from csv_train_new/black (rows 351-400)
   e.g. first 3: ['row_351_gold1-1.github_analyzed.csv', 'row_352_paysuccessfully_analyzed.csv', 'row_353_analyzed.csv']
 Wrote 50 file names → logs/test_black_files.txt
✅ No missing black TEST rows
📄 Combined manifest → logs/manifest_all_splits.csv

📊 Training Data Distribution:
label
0    350
1    350
Name: count, dtype: int64

📊 Test Data Distribution:
label
0    50
1    50
Name: count, dtype: int64

✅ Datasets created:
   🚀 Training dataset: 700 examples
   🧪 Test dataset: 100 examples
Some weights of BertForSequenceClassification were not initialized from the model checkpoint at bert-base-uncased and are newly initialized: ['classifier.bias', 'classifier.weight']
You should probably TRAIN this model on a down-stream task to be able to use it for predictions and inference.

🔄 Tokenizing datasets...
Map: 100%|███████████████████████████████████████████| 700/700 [00:01<00:00, 622.26 examples/s]
Map: 100%|███████████████████████████████████████████| 100/100 [00:00<00:00, 633.38 examples/s]

🚀 Starting model training...
📊 Training on 700 examples, evaluating on 100 examples
  0%|                                                                  | 0/525 [00:00<?, ?it/s]/Users/pintura/Downloads/FintuneLLM-master-4/venv/lib/python3.13/site-packages/torch/utils/data/dataloader.py:684: UserWarning: 'pin_memory' argument is set as true but not supported on MPS now, then device pinned memory won't be used.
  warnings.warn(warn_msg)
{'loss': 0.7128, 'grad_norm': 5.871600151062012, 'learning_rate': 9.800000000000001e-06, 'epoch': 0.29}
{'loss': 0.5824, 'grad_norm': 6.973364353179932, 'learning_rate': 1.98e-05, 'epoch': 0.57}     
{'loss': 0.5539, 'grad_norm': 13.849059104919434, 'learning_rate': 1.7694117647058826e-05, 'epoch': 0.86}
{'eval_loss': 0.5274534821510315, 'eval_accuracy': 0.79, 'eval_runtime': 8.9008, 'eval_samples_per_second': 11.235, 'eval_steps_per_second': 2.809, 'epoch': 1.0}                             
 33%|██████████████████▋                                     | 175/525 [07:51<27:04,  4.64s/it/Users/pintura/Downloads/FintuneLLM-master-4/venv/lib/python3.13/site-packages/torch/utils/data/dataloader.py:684: UserWarning: 'pin_memory' argument is set as true but not supported on MPS now, then device pinned memory won't be used.
  warnings.warn(warn_msg)
{'loss': 0.538, 'grad_norm': 35.390071868896484, 'learning_rate': 1.5341176470588238e-05, 'epoch': 1.14}
{'loss': 0.3577, 'grad_norm': 7.617355823516846, 'learning_rate': 1.2988235294117649e-05, 'epoch': 1.43}
{'loss': 0.4191, 'grad_norm': 4.666086673736572, 'learning_rate': 1.0635294117647059e-05, 'epoch': 1.71}
{'loss': 0.3278, 'grad_norm': 11.763408660888672, 'learning_rate': 8.28235294117647e-06, 'epoch': 2.0}
{'eval_loss': 0.331055223941803, 'eval_accuracy': 0.93, 'eval_runtime': 14.1782, 'eval_samples_per_second': 7.053, 'eval_steps_per_second': 1.763, 'epoch': 2.0}                              
 67%|█████████████████████████████████████▁                  | 350/525 [17:43<07:47,  2.67s/it/Users/pintura/Downloads/FintuneLLM-master-4/venv/lib/python3.13/site-packages/torch/utils/data/dataloader.py:684: UserWarning: 'pin_memory' argument is set as true but not supported on MPS now, then device pinned memory won't be used.
  warnings.warn(warn_msg)
{'loss': 0.3427, 'grad_norm': 0.06845663487911224, 'learning_rate': 5.929411764705883e-06, 'epoch': 2.29}
{'loss': 0.253, 'grad_norm': 332.6950378417969, 'learning_rate': 3.5764705882352948e-06, 'epoch': 2.57}
{'loss': 0.3096, 'grad_norm': 0.1902284473180771, 'learning_rate': 1.223529411764706e-06, 'epoch': 2.86}
{'eval_loss': 0.42597442865371704, 'eval_accuracy': 0.9, 'eval_runtime': 35.4743, 'eval_samples_per_second': 2.819, 'eval_steps_per_second': 0.705, 'epoch': 3.0}                             
{'train_runtime': 1771.2867, 'train_samples_per_second': 1.186, 'train_steps_per_second': 0.296, 'train_loss': 0.432519477662586, 'epoch': 3.0}                                               
100%|████████████████████████████████████████████████████████| 525/525 [29:31<00:00,  3.37s/it]
✅ Training completed.

🧪 Running final evaluation...
/Users/pintura/Downloads/FintuneLLM-master-4/venv/lib/python3.13/site-packages/torch/utils/data/dataloader.py:684: UserWarning: 'pin_memory' argument is set as true but not supported on MPS now, then device pinned memory won't be used.
  warnings.warn(warn_msg)
 80%|████████████████████████████████████████████████████████████████████████                  | 20/25 [00:19<00:05,  1.12s/it]100%|█████████████████████████████████████████████████████████████████████████████████████████████████████████████████████████████████████████████████████████████████████| 25/25 [00:22<00:00,  1.11it/s]
📊 Final Evaluation Results:
   eval_loss: 0.3311
   eval_accuracy: 0.9300
   eval_runtime: 23.4532
   eval_samples_per_second: 4.2640
   eval_steps_per_second: 1.0660
   epoch: 3.0000

 Generating detailed predictions...
/Users/pintura/Downloads/FintuneLLM-master-4/venv/lib/python3.13/site-packages/torch/utils/data/dataloader.py:684: UserWarning: 'pin_memory' argument is set as true but not supported on MPS now, then device pinned memory won't be used.
  warnings.warn(warn_msg)
100%|█████████████████████████████████████████████████████████████████████████████████████████████████████████████████████████████████████████████████████████████████████| 25/25 [00:13<00:00,  1.90it/s]

📊 Detailed Classification Report:
              precision    recall  f1-score   support

Not Phishing       0.96      0.90      0.93        50
    Phishing       0.91      0.96      0.93        50

    accuracy                           0.93       100
   macro avg       0.93      0.93      0.93       100
weighted avg       0.93      0.93      0.93       100


💾 Model saved to: phishing_train_3

============================================================
📦 FINAL TRAINING REPORT
============================================================
📊 Training Data:
   🟢 Not Phishing (white): 350 files used
   🔴 Phishing (black): 350 files used
   📊 Total training: 700 examples

🧪 Test Data:
   🟢 Not Phishing (white): 50 files used
   🔴 Phishing (black): 50 files used
   📊 Total test: 100 examples

 See detailed file lists in: logs (TXT manifests) and logs/manifest_all_splits.csv
============================================================


NUM TRAIN = 5
(venv) pintura@Pintura FintuneLLM-master-4 % python newwy_train.py
Transformers version: 4.56.2
🟢 Loading whitelist TRAIN rows 1–350 ...
✅ Loaded 350 items from csv_train_new/white (rows 1-350)
   e.g. first 3: ['row_1_classroom.google.com__analyzed.csv', 'row_2_www.dek-d.com__analyzed.csv', 'row_3_www.catdumb.com__analyzed.csv']
 Wrote 350 file names → logs/train_white_files.txt
✅ No missing white TRAIN rows
🔴 Loading blacklist TRAIN rows 1–350 ...
✅ Loaded 350 items from csv_train_new/black (rows 1-350)
   e.g. first 3: ['row_1_zro-sushi_analyzed.csv', 'row_2_xoxo-100746.weeblysite.com__analyzed.csv', 'row_3_www.opinionstage.com_page_1b58cfeb-47a6-4952-91cd-f34bada7d95d_analyzed.csv']
 Wrote 350 file names → logs/train_black_files.txt
✅ No missing black TRAIN rows

🧪 Loading whitelist TEST rows 351–400 ...
✅ Loaded 50 items from csv_train_new/white (rows 351-400)
   e.g. first 3: ['row_351_th.edreams.com__analyzed.csv', 'row_352_www.coches.com__analyzed.csv', 'row_353_urbansportsclub.com_en_analyzed.csv']
 Wrote 50 file names → logs/test_white_files.txt
✅ No missing white TEST rows
🧪 Loading blacklist TEST rows 351–400 ...
✅ Loaded 50 items from csv_train_new/black (rows 351-400)
   e.g. first 3: ['row_351_gold1-1.github_analyzed.csv', 'row_352_paysuccessfully_analyzed.csv', 'row_353_analyzed.csv']
 Wrote 50 file names → logs/test_black_files.txt
✅ No missing black TEST rows
📄 Combined manifest → logs/manifest_all_splits.csv

📊 Training Data Distribution:
label
0    350
1    350
Name: count, dtype: int64

📊 Test Data Distribution:
label
0    50
1    50
Name: count, dtype: int64

✅ Datasets created:
   🚀 Training dataset: 700 examples
   🧪 Test dataset: 100 examples
Some weights of BertForSequenceClassification were not initialized from the model checkpoint at bert-base-uncased and are newly initialized: ['classifier.bias', 'classifier.weight']
You should probably TRAIN this model on a down-stream task to be able to use it for predictions and inference.

🔄 Tokenizing datasets...
Map: 100%|███████████████████████████████████████████████████████████████████████████████████████████████████| 700/700 [00:01<00:00, 636.41 examples/s]
Map: 100%|███████████████████████████████████████████████████████████████████████████████████████████████████| 100/100 [00:00<00:00, 631.28 examples/s]

🚀 Starting model training...
📊 Training on 700 examples, evaluating on 100 examples
  0%|                                                                                                                          | 0/875 [00:00<?, ?it/s]/Users/pintura/Downloads/FintuneLLM-master-4/venv/lib/python3.13/site-packages/torch/utils/data/dataloader.py:684: UserWarning: 'pin_memory' argument is set as true but not supported on MPS now, then device pinned memory won't be used.
  warnings.warn(warn_msg)
{'loss': 0.6841, 'grad_norm': 5.1909379959106445, 'learning_rate': 9.800000000000001e-06, 'epoch': 0.29}                                               
{'loss': 0.5527, 'grad_norm': 12.63649845123291, 'learning_rate': 1.98e-05, 'epoch': 0.57}                                                             
{'loss': 0.6774, 'grad_norm': 29.541532516479492, 'learning_rate': 1.8735483870967744e-05, 'epoch': 0.86}                                              
{'eval_loss': 0.46173685789108276, 'eval_accuracy': 0.78, 'eval_runtime': 16.4547, 'eval_samples_per_second': 6.077, 'eval_steps_per_second': 1.519, 'epoch': 1.0}                                                                                                                                            
 20%|██████████████████████                                                                                        | 175/875 [15:32<2:15:34, 11.62s/it/Users/pintura/Downloads/FintuneLLM-master-4/venv/lib/python3.13/site-packages/torch/utils/data/dataloader.py:684: UserWarning: 'pin_memory' argument is set as true but not supported on MPS now, then device pinned memory won't be used.
  warnings.warn(warn_msg)
{'loss': 0.515, 'grad_norm': 13.077638626098633, 'learning_rate': 1.7445161290322583e-05, 'epoch': 1.14}                                               
 28%|██████████████████████████████▊                                                                               | 245/875 [21:25<1:33:57,  8.95s/it]{'loss': 0.4449, 'grad_norm': 20.447887420654297, 'learning_rate': 1.615483870967742e-05, 'epoch': 1.43}                                               
{'loss': 0.4054, 'grad_norm': 0.9930988550186157, 'learning_rate': 1.4864516129032261e-05, 'epoch': 1.71}                                              
{'loss': 0.3137, 'grad_norm': 25.271221160888672, 'learning_rate': 1.3574193548387098e-05, 'epoch': 2.0}                                               
{'eval_loss': 0.28032225370407104, 'eval_accuracy': 0.89, 'eval_runtime': 9.8479, 'eval_samples_per_second': 10.154, 'eval_steps_per_second': 2.539, 'epoch': 2.0}                                                                                                                                            
 40%|████████████████████████████████████████████▊                                                                   | 350/875 [28:27<48:29,  5.54s/it/Users/pintura/Downloads/FintuneLLM-master-4/venv/lib/python3.13/site-packages/torch/utils/data/dataloader.py:684: UserWarning: 'pin_memory' argument is set as true but not supported on MPS now, then device pinned memory won't be used.
  warnings.warn(warn_msg)
{'loss': 0.2786, 'grad_norm': 0.23994913697242737, 'learning_rate': 1.2283870967741936e-05, 'epoch': 2.29}                                             
{'loss': 0.2584, 'grad_norm': 31.913742065429688, 'learning_rate': 1.0993548387096775e-05, 'epoch': 2.57}                                              
{'loss': 0.2577, 'grad_norm': 3.9998090267181396, 'learning_rate': 9.703225806451615e-06, 'epoch': 2.86}                                               
{'eval_loss': 0.6330420970916748, 'eval_accuracy': 0.86, 'eval_runtime': 9.0936, 'eval_samples_per_second': 10.997, 'eval_steps_per_second': 2.749, 'epoch': 3.0}                                                                                                                                             
 60%|███████████████████████████████████████████████████████████████████▁                                            | 525/875 [50:01<18:53,  3.24s/it/Users/pintura/Downloads/FintuneLLM-master-4/venv/lib/python3.13/site-packages/torch/utils/data/dataloader.py:684: UserWarning: 'pin_memory' argument is set as true but not supported on MPS now, then device pinned memory won't be used.
  warnings.warn(warn_msg)
{'loss': 0.4179, 'grad_norm': 0.3764345347881317, 'learning_rate': 8.412903225806453e-06, 'epoch': 3.14}                                               
{'loss': 0.1252, 'grad_norm': 79.8558120727539, 'learning_rate': 7.122580645161291e-06, 'epoch': 3.43}                                                 
{'loss': 0.1437, 'grad_norm': 0.08086330443620682, 'learning_rate': 5.83225806451613e-06, 'epoch': 3.71}                                               
{'loss': 0.1584, 'grad_norm': 0.057791437953710556, 'learning_rate': 4.541935483870968e-06, 'epoch': 4.0}                                              
{'eval_loss': 0.5025784373283386, 'eval_accuracy': 0.89, 'eval_runtime': 8.2303, 'eval_samples_per_second': 12.15, 'eval_steps_per_second': 3.038, 'epoch': 4.0}                                                                                                                                              
 80%|████████████████████████████████████████████████████████████████████████████████████████                      | 700/875 [1:21:46<06:11,  2.12s/it/Users/pintura/Downloads/FintuneLLM-master-4/venv/lib/python3.13/site-packages/torch/utils/data/dataloader.py:684: UserWarning: 'pin_memory' argument is set as true but not supported on MPS now, then device pinned memory won't be used.
  warnings.warn(warn_msg)
{'loss': 0.0529, 'grad_norm': 0.04364011809229851, 'learning_rate': 3.2516129032258065e-06, 'epoch': 4.29}                                             
{'loss': 0.1585, 'grad_norm': 0.11173352599143982, 'learning_rate': 1.9612903225806453e-06, 'epoch': 4.57}                                             
{'loss': 0.1276, 'grad_norm': 0.07661930471658707, 'learning_rate': 6.709677419354839e-07, 'epoch': 4.86}                                              
{'eval_loss': 0.45042142271995544, 'eval_accuracy': 0.91, 'eval_runtime': 19.233, 'eval_samples_per_second': 5.199, 'eval_steps_per_second': 1.3, 'epoch': 5.0}                                                                                                                                               
{'train_runtime': 5618.1423, 'train_samples_per_second': 0.623, 'train_steps_per_second': 0.156, 'train_loss': 0.32237096187046593, 'epoch': 5.0}      
100%|██████████████████████████████████████████████████████████████████████████████████████████████████████████████| 875/875 [1:33:38<00:00,  6.42s/it]
✅ Training completed.

🧪 Running final evaluation...
/Users/pintura/Downloads/FintuneLLM-master-4/venv/lib/python3.13/site-packages/torch/utils/data/dataloader.py:684: UserWarning: 'pin_memory' argument is set as true but not supported on MPS now, then device pinned memory won't be used.
  warnings.warn(warn_msg)
100%|██████████████████████████████████████████████████████████████████████████████████████████████████████████████████| 25/25 [00:19<00:00,  1.25it/s]
📊 Final Evaluation Results:
   eval_loss: 0.4504
   eval_accuracy: 0.9100
   eval_runtime: 20.9198
   eval_samples_per_second: 4.7800
   eval_steps_per_second: 1.1950
   epoch: 5.0000

 Generating detailed predictions...
/Users/pintura/Downloads/FintuneLLM-master-4/venv/lib/python3.13/site-packages/torch/utils/data/dataloader.py:684: UserWarning: 'pin_memory' argument is set as true but not supported on MPS now, then device pinned memory won't be used.
  warnings.warn(warn_msg)
100%|██████████████████████████████████████████████████████████████████████████████████████████████████████████████████| 25/25 [00:20<00:00,  1.22it/s]

📊 Detailed Classification Report:
              precision    recall  f1-score   support

Not Phishing       0.86      0.98      0.92        50
    Phishing       0.98      0.84      0.90        50

    accuracy                           0.91       100
   macro avg       0.92      0.91      0.91       100
weighted avg       0.92      0.91      0.91       100


💾 Model saved to: phishing_train_5

============================================================
📦 FINAL TRAINING REPORT
============================================================
📊 Training Data:
   🟢 Not Phishing (white): 350 files used
   🔴 Phishing (black): 350 files used
   📊 Total training: 700 examples

🧪 Test Data:
   🟢 Not Phishing (white): 50 files used
   🔴 Phishing (black): 50 files used
   📊 Total test: 100 examples

 See detailed file lists in: logs (TXT manifests) and logs/manifest_all_splits.csv
============================================================
(venv) pintura@Pintura FintuneLLM-master-4 %  



pintura@Pintura FintuneLLM-master-4 % python3 -m venv venv                                                                                                           
source venv/bin/activate                   
(venv) pintura@Pintura FintuneLLM-master-4 % python3 newwy_train.py
Transformers version: 4.56.2
🟢 Loading whitelist TRAIN rows 1–350 ...
✅ Loaded 350 items from csv_train_new/white (rows 1-350)
   e.g. first 3: ['row_1_classroom.google.com__analyzed.csv', 'row_2_www.dek-d.com__analyzed.csv', 'row_3_www.catdumb.com__analyzed.csv']
 Wrote 350 file names → logs/train_white_files.txt
✅ No missing white TRAIN rows
🔴 Loading blacklist TRAIN rows 1–350 ...
✅ Loaded 350 items from csv_train_new/black (rows 1-350)
   e.g. first 3: ['row_1_zro-sushi_analyzed.csv', 'row_2_xoxo-100746.weeblysite.com__analyzed.csv', 'row_3_www.opinionstage.com_page_1b58cfeb-47a6-4952-91cd-f34bada7d95d_analyzed.csv']
 Wrote 350 file names → logs/train_black_files.txt
✅ No missing black TRAIN rows

🧪 Loading whitelist TEST rows 351–400 ...
✅ Loaded 50 items from csv_train_new/white (rows 351-400)
   e.g. first 3: ['row_351_th.edreams.com__analyzed.csv', 'row_352_www.coches.com__analyzed.csv', 'row_353_urbansportsclub.com_en_analyzed.csv']
 Wrote 50 file names → logs/test_white_files.txt
✅ No missing white TEST rows
🧪 Loading blacklist TEST rows 351–400 ...
✅ Loaded 50 items from csv_train_new/black (rows 351-400)
   e.g. first 3: ['row_351_gold1-1.github_analyzed.csv', 'row_352_paysuccessfully_analyzed.csv', 'row_353_analyzed.csv']
 Wrote 50 file names → logs/test_black_files.txt
✅ No missing black TEST rows
📄 Combined manifest → logs/manifest_all_splits.csv

📊 Training Data Distribution:
label
0    350
1    350
Name: count, dtype: int64

📊 Test Data Distribution:
label
0    50
1    50
Name: count, dtype: int64

✅ Datasets created:
   🚀 Training dataset: 700 examples
   🧪 Test dataset: 100 examples
Some weights of BertForSequenceClassification were not initialized from the model checkpoint at bert-base-uncased and are newly initialized: ['classifier.bias', 'classifier.weight']
You should probably TRAIN this model on a down-stream task to be able to use it for predictions and inference.

🔄 Tokenizing datasets...
Map: 100%|█████████████████████████████████████████████████████████████████████████████████████████████████████████████████████████████████████| 700/700 [00:01<00:00, 619.59 examples/s]
Map: 100%|█████████████████████████████████████████████████████████████████████████████████████████████████████████████████████████████████████| 100/100 [00:00<00:00, 621.74 examples/s]

🚀 Starting model training...
📊 Training on 700 examples, evaluating on 100 examples
  0%|                                                                                                                                                           | 0/1750 [00:00<?, ?it/s]/Users/pintura/Downloads/FintuneLLM-master-4/venv/lib/python3.13/site-packages/torch/utils/data/dataloader.py:684: UserWarning: 'pin_memory' argument is set as true but not supported on MPS now, then device pinned memory won't be used.
  warnings.warn(warn_msg)
{'loss': 0.6792, 'grad_norm': 11.1589994430542, 'learning_rate': 9.800000000000001e-06, 'epoch': 0.29}                                                                                   
{'loss': 0.5855, 'grad_norm': 20.680360794067383, 'learning_rate': 1.98e-05, 'epoch': 0.57}                                                                                              
{'loss': 0.6155, 'grad_norm': 21.813180923461914, 'learning_rate': 1.940606060606061e-05, 'epoch': 0.86}                                                                                 
{'eval_loss': 0.4756496846675873, 'eval_accuracy': 0.79, 'eval_runtime': 33.7319, 'eval_samples_per_second': 2.965, 'eval_steps_per_second': 0.741, 'epoch': 1.0}                        
 10%|██████████████                                                                                                                              | 175/1750 [1:59:18<19:13:27, 43.94s/it/Users/pintura/Downloads/FintuneLLM-master-4/venv/lib/python3.13/site-packages/torch/utils/data/dataloader.py:684: UserWarning: 'pin_memory' argument is set as true but not supported on MPS now, then device pinned memory won't be used.
  warnings.warn(warn_msg)
{'loss': 0.5129, 'grad_norm': 10.16437816619873, 'learning_rate': 1.88e-05, 'epoch': 1.14}                                                                                               
{'loss': 0.3463, 'grad_norm': 12.099170684814453, 'learning_rate': 1.8193939393939396e-05, 'epoch': 1.43}                                                                                
{'loss': 0.4266, 'grad_norm': 0.28827863931655884, 'learning_rate': 1.758787878787879e-05, 'epoch': 1.71}                                                                                
{'loss': 0.2737, 'grad_norm': 10.734330177307129, 'learning_rate': 1.6981818181818183e-05, 'epoch': 2.0}                                                                                 
{'eval_loss': 0.35858404636383057, 'eval_accuracy': 0.9, 'eval_runtime': 22.7915, 'eval_samples_per_second': 4.388, 'eval_steps_per_second': 1.097, 'epoch': 2.0}                        
 20%|████████████████████████████                                                                                                                | 350/1750 [3:47:29<11:58:08, 30.78s/it/Users/pintura/Downloads/FintuneLLM-master-4/venv/lib/python3.13/site-packages/torch/utils/data/dataloader.py:684: UserWarning: 'pin_memory' argument is set as true but not supported on MPS now, then device pinned memory won't be used.
  warnings.warn(warn_msg)
{'loss': 0.2571, 'grad_norm': 0.15537436306476593, 'learning_rate': 1.6375757575757577e-05, 'epoch': 2.29}                                                                               
{'loss': 0.2341, 'grad_norm': 16.726903915405273, 'learning_rate': 1.576969696969697e-05, 'epoch': 2.57}                                                                                 
{'loss': 0.2833, 'grad_norm': 45.160850524902344, 'learning_rate': 1.5163636363636366e-05, 'epoch': 2.86}                                                                                
{'eval_loss': 0.36139094829559326, 'eval_accuracy': 0.9, 'eval_runtime': 12.9074, 'eval_samples_per_second': 7.748, 'eval_steps_per_second': 1.937, 'epoch': 3.0}                        
 30%|██████████████████████████████████████████                                                                                                  | 525/1750 [5:27:48<10:11:54, 29.97s/it/Users/pintura/Downloads/FintuneLLM-master-4/venv/lib/python3.13/site-packages/torch/utils/data/dataloader.py:684: UserWarning: 'pin_memory' argument is set as true but not supported on MPS now, then device pinned memory won't be used.
  warnings.warn(warn_msg)
{'loss': 0.269, 'grad_norm': 7.396975994110107, 'learning_rate': 1.4557575757575759e-05, 'epoch': 3.14}                                                                                  
{'loss': 0.1827, 'grad_norm': 10.47530460357666, 'learning_rate': 1.3951515151515154e-05, 'epoch': 3.43}                                                                                 
{'loss': 0.2188, 'grad_norm': 0.03244367986917496, 'learning_rate': 1.3345454545454546e-05, 'epoch': 3.71}                                                                               
{'loss': 0.0285, 'grad_norm': 0.06668313592672348, 'learning_rate': 1.2739393939393941e-05, 'epoch': 4.0}                                                                                
{'eval_loss': 0.6154566407203674, 'eval_accuracy': 0.88, 'eval_runtime': 12.2443, 'eval_samples_per_second': 8.167, 'eval_steps_per_second': 2.042, 'epoch': 4.0}                        
 40%|████████████████████████████████████████████████████████▁                                                                                    | 700/1750 [7:04:13<9:57:11, 34.13s/it/Users/pintura/Downloads/FintuneLLM-master-4/venv/lib/python3.13/site-packages/torch/utils/data/dataloader.py:684: UserWarning: 'pin_memory' argument is set as true but not supported on MPS now, then device pinned memory won't be used.
  warnings.warn(warn_msg)
{'loss': 0.0503, 'grad_norm': 0.010572785511612892, 'learning_rate': 1.2133333333333335e-05, 'epoch': 4.29}                                                                              
{'loss': 0.021, 'grad_norm': 0.03883695602416992, 'learning_rate': 1.152727272727273e-05, 'epoch': 4.57}                                                                                 
{'loss': 0.1653, 'grad_norm': 99.22583770751953, 'learning_rate': 1.0921212121212122e-05, 'epoch': 4.86}                                                                                 
{'eval_loss': 0.8486466407775879, 'eval_accuracy': 0.85, 'eval_runtime': 17.4096, 'eval_samples_per_second': 5.744, 'eval_steps_per_second': 1.436, 'epoch': 5.0}                        
 50%|██████████████████████████████████████████████████████████████████████                                                                      | 875/1750 [8:40:59<10:31:43, 43.32s/it/Users/pintura/Downloads/FintuneLLM-master-4/venv/lib/python3.13/site-packages/torch/utils/data/dataloader.py:684: UserWarning: 'pin_memory' argument is set as true but not supported on MPS now, then device pinned memory won't be used.
  warnings.warn(warn_msg)
{'loss': 0.0739, 'grad_norm': 0.09950462728738785, 'learning_rate': 1.0315151515151515e-05, 'epoch': 5.14}                                                                               
{'loss': 0.0521, 'grad_norm': 0.016481827944517136, 'learning_rate': 9.70909090909091e-06, 'epoch': 5.43}                                                                                
{'loss': 0.0704, 'grad_norm': 0.04060090333223343, 'learning_rate': 9.103030303030304e-06, 'epoch': 5.71}                                                                                
{'loss': 0.0752, 'grad_norm': 0.024206791073083878, 'learning_rate': 8.496969696969697e-06, 'epoch': 6.0}                                                                                
{'eval_loss': 1.0036288499832153, 'eval_accuracy': 0.83, 'eval_runtime': 21.8298, 'eval_samples_per_second': 4.581, 'eval_steps_per_second': 1.145, 'epoch': 6.0}                        
 60%|███████████████████████████████████████████████████████████████████████████████████▁                                                       | 1050/1750 [10:32:44<7:10:24, 36.89s/it/Users/pintura/Downloads/FintuneLLM-master-4/venv/lib/python3.13/site-packages/torch/utils/data/dataloader.py:684: UserWarning: 'pin_memory' argument is set as true but not supported on MPS now, then device pinned memory won't be used.
  warnings.warn(warn_msg)
{'loss': 0.0547, 'grad_norm': 0.069175124168396, 'learning_rate': 7.89090909090909e-06, 'epoch': 6.29}                                                                                   
{'loss': 0.0384, 'grad_norm': 16.117029190063477, 'learning_rate': 7.284848484848486e-06, 'epoch': 6.57}                                                                                 
{'loss': 0.0048, 'grad_norm': 0.0609678253531456, 'learning_rate': 6.678787878787879e-06, 'epoch': 6.86}                                                                                 
{'eval_loss': 0.8402491211891174, 'eval_accuracy': 0.87, 'eval_runtime': 18.6495, 'eval_samples_per_second': 5.362, 'eval_steps_per_second': 1.341, 'epoch': 7.0}                        
 70%|█████████████████████████████████████████████████████████████████████████████████████████████████▁                                         | 1225/1750 [12:11:17<2:58:15, 20.37s/it/Users/pintura/Downloads/FintuneLLM-master-4/venv/lib/python3.13/site-packages/torch/utils/data/dataloader.py:684: UserWarning: 'pin_memory' argument is set as true but not supported on MPS now, then device pinned memory won't be used.
  warnings.warn(warn_msg)
{'loss': 0.0005, 'grad_norm': 0.004266772884875536, 'learning_rate': 6.072727272727274e-06, 'epoch': 7.14}                                                                               
{'loss': 0.0286, 'grad_norm': 0.004313442390412092, 'learning_rate': 5.466666666666667e-06, 'epoch': 7.43}                                                                               
{'loss': 0.0288, 'grad_norm': 0.0034501112531870604, 'learning_rate': 4.8606060606060615e-06, 'epoch': 7.71}                                                                             
 79%|█████████████████████████████████████████████████████████████████████████████████████████████████████████████▁                             | 1374/1750 [13:15:36<2:05:06, 19.96s/it]
{'loss': 0.0012, 'grad_norm': 0.008853795938193798, 'learning_rate': 4.254545454545455e-06, 'epoch': 8.0}                                                                                
{'eval_loss': 0.8636436462402344, 'eval_accuracy': 0.88, 'eval_runtime': 10.9062, 'eval_samples_per_second': 9.169, 'eval_steps_per_second': 2.292, 'epoch': 8.0}                        
 80%|███████████████████████████████████████████████████████████████████████████████████████████████████████████████▁                           | 1400/1750 [13:28:39<3:27:16, 35.53s/it/Users/pintura/Downloads/FintuneLLM-master-4/venv/lib/python3.13/site-packages/torch/utils/data/dataloader.py:684: UserWarning: 'pin_memory' argument is set as true but not supported on MPS now, then device pinned memory won't be used.
  warnings.warn(warn_msg)
{'loss': 0.0002, 'grad_norm': 0.02496710792183876, 'learning_rate': 3.648484848484849e-06, 'epoch': 8.29}                                                                                
{'loss': 0.0236, 'grad_norm': 0.0046837045811116695, 'learning_rate': 3.0424242424242427e-06, 'epoch': 8.57}                                                                             
{'loss': 0.0002, 'grad_norm': 0.004680536221712828, 'learning_rate': 2.4363636363636366e-06, 'epoch': 8.86}                                                                              
{'eval_loss': 0.8901225328445435, 'eval_accuracy': 0.88, 'eval_runtime': 37.7365, 'eval_samples_per_second': 2.65, 'eval_steps_per_second': 0.662, 'epoch': 9.0}                         
 90%|█████████████████████████████████████████████████████████████████████████████████████████████████████████████████████████████              | 1575/1750 [15:00:42<1:01:44, 21.17s/it/Users/pintura/Downloads/FintuneLLM-master-4/venv/lib/python3.13/site-packages/torch/utils/data/dataloader.py:684: UserWarning: 'pin_memory' argument is set as true but not supported on MPS now, then device pinned memory won't be used.
  warnings.warn(warn_msg)
{'loss': 0.0225, 'grad_norm': 0.02298242226243019, 'learning_rate': 1.8303030303030305e-06, 'epoch': 9.14}                                                                               
{'loss': 0.0002, 'grad_norm': 0.011271754279732704, 'learning_rate': 1.2242424242424242e-06, 'epoch': 9.43}                                                                              
{'loss': 0.0002, 'grad_norm': 0.005938745103776455, 'learning_rate': 6.181818181818182e-07, 'epoch': 9.71}                                                                               
{'loss': 0.0027, 'grad_norm': 0.00290299323387444, 'learning_rate': 1.2121212121212122e-08, 'epoch': 10.0}                                                                               
{'eval_loss': 0.8886975049972534, 'eval_accuracy': 0.88, 'eval_runtime': 12.0549, 'eval_samples_per_second': 8.295, 'eval_steps_per_second': 2.074, 'epoch': 10.0}                       
{'train_runtime': 60698.8491, 'train_samples_per_second': 0.115, 'train_steps_per_second': 0.029, 'train_loss': 0.16079413808908846, 'epoch': 10.0}                                      
100%|█████████████████████████████████████████████████████████████████████████████████████████████████████████████████████████████████████████████| 1750/1750 [16:51:40<00:00, 34.69s/it]
✅ Training completed.

🧪 Running final evaluation...
/Users/pintura/Downloads/FintuneLLM-master-4/venv/lib/python3.13/site-packages/torch/utils/data/dataloader.py:684: UserWarning: 'pin_memory' argument is set as true but not supported on MPS now, then device pinned memory won't be used.
  warnings.warn(warn_msg)
100%|████████████████████████████████████████████████████████████████████████████████████████████████████████████████████████████████████████████████████| 25/25 [00:06<00:00,  3.67it/s]
📊 Final Evaluation Results:
   eval_loss: 0.3586
   eval_accuracy: 0.9000
   eval_runtime: 13.8508
   eval_samples_per_second: 7.2200
   eval_steps_per_second: 1.8050
   epoch: 10.0000

 Generating detailed predictions...
/Users/pintura/Downloads/FintuneLLM-master-4/venv/lib/python3.13/site-packages/torch/utils/data/dataloader.py:684: UserWarning: 'pin_memory' argument is set as true but not supported on MPS now, then device pinned memory won't be used.
  warnings.warn(warn_msg)
100%|████████████████████████████████████████████████████████████████████████████████████████████████████████████████████████████████████████████████████| 25/25 [00:06<00:00,  3.86it/s]

📊 Detailed Classification Report:
              precision    recall  f1-score   support

Not Phishing       0.92      0.88      0.90        50
    Phishing       0.88      0.92      0.90        50

    accuracy                           0.90       100
   macro avg       0.90      0.90      0.90       100
weighted avg       0.90      0.90      0.90       100


💾 Model saved to: phishing_train_10

============================================================
📦 FINAL TRAINING REPORT
============================================================
📊 Training Data:
   🟢 Not Phishing (white): 350 files used
   🔴 Phishing (black): 350 files used
   📊 Total training: 700 examples

🧪 Test Data:
   🟢 Not Phishing (white): 50 files used
   🔴 Phishing (black): 50 files used
   📊 Total test: 100 examples

 See detailed file lists in: logs (TXT manifests) and logs/manifest_all_splits.csv
============================================================
(venv) pintura@Pintura FintuneLLM-master-4 % 
(venv) pintura@Pintura FintuneLLM-master-4 % 